"id","text","rating","afinn","lsd","vader"
1,"sm",0,0,0,0
2,"tender and touch.",0,0.4,1,0
3,"this i a beautiful middle grade story about b friend, sussy and guy, four grad who do everything together. they end getting a spotted lizard, name h matylda, and make up a warrior origin story for h. short aft, an accident change their live, and sussy decide she must love matylda so deep and care for h so perfect in order to hold onto guy and hi memory. this story was so credibly touch and beautiful, and sussy's journey through h grief move at just the right pace. side note: i cry through most of this book. - - karina glaser from the b book we read in may 2017: https: / / bookriot. com / 2017 / 06 / 02 / riot -...",0,0.156,0.4,0.892
4,"on order at our local bookshop! look forward to this summer read - aloud with the girl.",0,0,1,0
5,"* * spoil alert * * i chose this book because i love children book!!!",0,0.2,0,0.806
6,"o",0,0,0,0
7,"a cute book with playful illustrate & text by leuyen pham. a full view to come when i see the finish book with the die cut in their proper place. ( read a f & g ).",0,0,0.5,-0.026
8,"breathe i a beautiful illustrate picture book that will have children smile. fabulous underwater scene.",0,0.6,1,0.869
9,"decline to com.",0,0,0,0
10,"amy i approach by a woman, camilla jaleski, who claim to be h mother. now amy doesn't know what or who to believe...",0,0,0,0
11,"sobre a gratidao e a importancia de a expressar - mos a todas a pessoas por quem a sentimos.",0,0,0,0
12,"ok, so i read this book because the tim burton movie was about to be lease. i should have just wait for the movie and skipped the book. i couldn't wait to get through the pointless, without a plot book. the book i have include, "" through the look glass "" but i just couldn't be put through any more so i stopped at the end of alice in wonderland.",0,-0.2,-0.5,-0.353
13,"scribe the old - time way of pick apple and the emote and pride anna and h family gain.",0,0.4,1,0.7
14,"comparative lit. student might enjoy use this verse of puss 'n boot in their study. it very charm, and a cat i a cat in any culture.",0,0.5,1,0.735
15,""" no matte what they did, big bob and little bob did not do it the same. "" the spread illustrate that great line are my favorite part.",0,0.25,1,0.71
16,"top 10 project book 2017 ( booklist )",0,0.4,0,0.202
17,"this i an alphabet book for read who know their stuff. a i for salad? i can almost hear the chorus of "" nooooo! "" come from a preschool storytime group. a isn't for salad. however, there i an alligator hold a bowl of salad in the correspond picture. savvy listen will appreciate the goofy humor of lester's book, where "" b i for viking, "" and, my favorite, "" x and y are not important letter. never use them. "" this i b for the kid at the top of our age range, probably 4 year olds. they would need to be old enough to appreciate the joke that i the whole layout of this book, and to know slight more obscure animal like beaver, iguana, and narwhal. luckily, lester include an endpage that explain the joke, if read haven't caught on beforehand. the illustrate are appropriate funky, the "" a "" on the cover i wiggle, a though it can't even sit still for you to start the book. the illustrate are cartoonish, with bold black outline, and the animal all seem a little risque, a though you wouldn't soon find them in a "" proper "" alphabet book. this would slide right to any alphabet theme storytime, or it would go well with any book where the audience ha to correct the read ( for stance, i might pair it with don't forget the bacon, by pat hutchins. ) with four year olds, a possible project idea would be to have them make their own a i for salad letter page, pick a letter and think of the that don't start with that letter.",0,0.371,0.667,0.977
18,"well - written with great illustrate, this book doe a great job of show how the animal he saw l darwin to contemplate the common accept "" truths "" of hi day, without overwhelm the read ( or hearer, in our case ) with science.",0,0.467,0.667,0.96
19,"kitapla ilgili yazimizi okumak icin: http: / / 1cay1kitap. com / bir - seftali - bin...",0,0,0,0
20,"this one i go to get check out a lot in my library just because it about underwear!",0,0,0,0
21,"this book i a true story about henry, who i a slave, and use the underground railroad to escape to freedom. this book i great for young children to learn about the underground railroad. it use easy language for young read and vivid picture to support the text. i would use this book to teach k - 5 student about the underground railroad. it off another perspective of the underground railroad beside the harriet tubman story i learn about in school.",0,0.3,1,0.955
22,"this book scar me a kid. must behave. must not get roll to pastry.",0,0,-1,0
23,"light story for very young kid. very cute character with real life situate. sweet.",0,0.4,1,0.742
24,"i receive a copy of this book from bloomsbury usa children book via netgalley in exchange for an hon view.",0,0,0,0
25,"root, p. ( 2009 ). paula bunyan. new york: farrar, straus and giroux. 0374357595 a new twist on a tall tale, paula bunyan share the story of famous paul bunyan's young sister paula, who isn't such a little sister since she a big a h broth. this book share many of paula's adventure, but particular focus on h love of sing. a love she can't pursue because h voice i so loud that she shatter people window with h volume. it i on when paula goes to the wood that she i final able to sing free and make friend with the wild animal. but when paula encounter a portion of the wood bee cut down, paula must front a problem large than h that ha modern imply. with this create of a new character to enter to the story of america's past, root provide equal foot for girl since paula i just a strong a h broth. activities to do with the book: this would be an excellent picturebook to share if a teach were do a it on american history or tall tale. the story doe assume that the read ha knowledge of paul bunyan and hi exploit, so a teach would have to introduce him first. student could create their own character and tall tale in response to hear or read this book. also, a numb of classic children song are incorporate to the illustrate and could prompt student sing alongs. on a more serious note, a teach could talk about web of relationship among animal and their environment and about forestation and how it ha been a develop problem for over a century. favorite quote: "" everyone know about paul bunyan, with hi woodcutter ax and hi big blue ox, babe. but not many people know about paula bunyan, hi little sister. maybe "" little "" isn't the right word. aft all, she was a tall a a pine tree and a strong a a doz moose. "" "" it got so paula took to humming under h breath instead of sing out loud, just so nobody would holler that she was break their window or chipping their b china. "" "" when the bear growl, she growl right back. "" "" now, folk say the mosquitoes up north are mighty bad, and i believe it true, because one day a few hungry mosquitoes carry off paula's bear. "" for more of my view, visit sjkessel. blogspot. com.",0,0.174,0.394,0.993
26,"lemony snicket i the man.",0,0,0,0
27,"a love quick read with short chapter that make it easy to keep turn the page.",0,0.4,1,0.796
28,"my copy ha a different cover.",0,0.4,0,0.34
29,"this book was a little dark for me. it was very episodic, with the dog move on from place to place and struggle to survive, lose most people it love along the way. i was just glad it was over by the end, but then around age 12, i was a fan of "" gray dawn "", a date but excite story of a loyal collie misadventure. this was just too grim for me and didn't have enough to make up for it.",0,0.343,0,0.814
30,"i did a book port on h. she an credible woman.",0,0,1,0
31,"i was afraid this would be a bob shea rip - off, but it wasn't at all. i won't spoil it for people, but this book i sup cute! i love it! i guess i could have study the cover a bit close... the spread with the rainbow and ball i probably my favorite. it a sweet little book.",0,0.28,0.143,0.966
32,"awesome",0,0.8,1,0.625
33,"have add a vip post script!!! see below. once i have read the two complete of jane austen's finished "" sanditon "" - i've already read "" rebecca's tale "", sally beauman's sequel to daphne du maurier's classic "" rebecca "", ( good!!! was that whirring sound dear daphne spinning in h grave??? ) - i think i will get stuck to this sequel to "" wind in the willow "". and william horwood ha written not on one sequel but several!! a regular feast for the desperate love of the original. ( i may well be one of those!! ) then i have this feel - call it "" inspiration "" - that i might be then ready to seize my p and scribe a sequel to....... the bible!!! in particular the new testament. but first i've got to get my paw on this willow in winter. shall be fun to be unite with rat, moley, badge and... mmm, was never over fond of the deceitful toad. a shame kenneth won't be there. but i'm sure he too busy spinning. and not thread!!! ps. just remember that beatrix potter, no less, wrote a prequel to "" the owl and the pussy - cat "" by edward lear. the book, much large than h familiar pocket size classic, ( this one ha eight chapter ), was publish in 1930. but beatrix was original inspired in 1883 when age on 17 while on a family seaside holiday at ilfracombe in devon where the long flight of stair lead down to the harbour gave h the idea for a story. that story was "" the tale of little pig robinson "", and she was still develop it idea in 1901 and 1902!! she sketch a numb of seaside town for h tale include lyme regis in dorset where jane austen holiday and set a dramatic scene for h novel "" persuasion "" and the high shed for dry net came from hastings in sussex where inspector foyle made hi contribute to wwii. the story explain exact how that pig from lear end up on a tropical island and the pussy - cat who help him to seek refuge there may well be the one whose marriage ceremony he perform there 18 months aft hi arrival.",0,0.133,0.407,0.991
34,"menyenangkan jika mampu menghadirkan pendidikan ala sekolah toto di indonesia",0,0,0,0
35,"an excellent read for teenage girl, jacqueline wilson capture the problem and worry of teen girl well and i able to portray them in an amuse and entertain way. a very enjoy read and one of my favourite book from when i was a teenage.",0,0.12,0.5,0.827
36,"finish read the first part. it i very different from how i know the story from movie and children book. more about h grow longer and small.",0,0,0,0
37,"this i my numb one favorite book!",0,0.1,0,0.224
38,"anything with balloon make me smile",0,0.4,1,0.361
39,"it was awesome what i like b i the front cover",0,0.6,1,0.765
40,"must reread: )",0,0,0,0
41,"interesting. i like how it name lot of part of a book without bee too overbear.",0,0.4,0.333,0.637
42,"sm",0,0,0,0
43,"view pend...",0,0,0,0
44,"sm",0,0,0,0
45,"sm",0,0,0,0
46,"i member read all of these book and i love them!",0,0.6,1,0.67
47,"what can you do with on one mitt? use your imagination! award - winning poet kristine o'connell george show that the simple object can be a springboard to playful exploration. spare rhyme text and bright, lively illustrate celebrate a small child joyful discovery of many the she can do, be, and play with a single mitt. and when she final find the mitten miss mate, two mitt open up a whole new realm of possibility. once again, the creator of book! look at the world through a young child eye, reveal the fun that hidden in everyday the. subject: lost article - - juvenile fiction rhyme - - juvenile fiction mitt - - juvenile fiction. clothe and dress - - juvenile fiction",0,0.327,0.692,0.981
48,"this caldecott honor book ( 1983 ) i a story told through simple vignette of the life of a young girl live with h grandparent in the appalachian mountain. the love of family shine through the child voice. a beautiful pair of text and illustrate.",0,0.533,0.5,0.906
49,"check this out for my boy base on view. have check it, so we've had it for 6 week and never peek inside. he just not interest.",0,0.2,0,-0.357
50,"1 ) "" can you imagine a world alone? what would you do? would you be happy? ( student response ) think about your favorite the to do. ( g the student time to think ) i it more fun to do that activity by yourself or with a friend? ( student response ). this book i about a boy and a penguin. while i read this book, i want you to think about what the author i try to tell you. "" 2 ) lay groundwork for help children understand the theme, invite personal connection, raise question in the readers' mind 3 ) i chose this book because it show the journey of friendship. the penguin decide that he want to try to fly on hi own, but soon realize that it i much more fun to share moment with hi friend. the penguin learn to appreciate hi friendship with the boy. this book, similar to other book in my text set, show that friend are always there for each other. in the lion of little rock, marlee risk everything to protect liz and h family from re.",0,0.277,0.875,0.99
51,"a aster threat dovella's world of edlena, all hope rest on the shoulder of one determine young woman. sixteen - year - old apprentice engineer dovella i eager await the moment that will bring h heart sire: in four day she will undergo the once - in - a - lifetime rite of the heal and become a fully - fledged member of the healer guild. but when there i trouble with the sacred machine that provide power for the village, an evil regime, threat to overthrow the council. i the power failure a sign of the disfavour of the god, or are there dark human force at work? dovella i the on one who can make the journey to the faraway source lake to find out, but to get there in time she would have to miss the all - important rite...",0,-0.127,-0.143,-0.952
52,"i love this book. a lion end up in the library and the are fine until he break the rule but to be fair lion had a good reason for break the rule. read this wonderful book to learn why lion broke the rule and what happen.",0,0.433,0.667,0.903
53,"o",0,0,0,0
54,"i thought this was a cute read, my eight year old daughter read it with me and she enjoy it a well. we thought the description of suit for children of all age was a little off i do not think my 4 year old would have understood some of the word. also it seem a little fuse i think a read through and edit i need to help sort through some of the tail. other than that real cute story.",0,0.4,1,0.919
55,"i love this hilarious book... until the last chapter.",0,0.5,1,0.785
56,"perfect for little one steppe out on their own and form try to maintain posit relationship. high commend! a great book for spring! www. abitofliteracy. com",0,0.533,1,0.906
57,"o",0,0,0,0
58,"can't believe i never read this before!!",0,0,0,0
59,"tassa tuuli selittaa lyhyesti joka aukeamalla, mita tekee missakin kuussa ( tyyliin: "" huhtikuussa lennattelen leijoja leppoisasti taivaalla "" ( leppoisasti?? ) ja "" toukokuussa huiskin teralehtia sinne tanne "" ( teralehtia?? ) ) ja siihen sitten tietysti kuva. kuvat ovat ihan hienoja ( jos tykkaa tosi minimalistisesta ilmaisusta ), mutta jotain enemman tahan nyt olisi kaivannut... vaikkapa riimeja tai muuta kielella leikittelya. tai jotain jota voisi etsia joka sivulta ( aika monessa kuvassa oli tupsupipo, muttei kuitenkaan kaikissa ). jotain.",0,0,1,0
60,"fun picture how animal inside machine make them work. - - monty k.",0,0.8,1,0.511
61,"funny quick read",0,0.8,1,0.44
62,"3.5 star. create and interesting, with a surprising dark sense of humor. wasn't quite a fun a i'd hop, but a cute read.",0,0.5,0.714,0.761
63,"one of the many easter egg in kraken. most recruit at the magical police squad train cent f to it a "" hogwarts "". but a few call it "" miss cackle "" and look superior when the other don't get the reference.",0,0,1,0.593
64,"never move to kansas the could be a tornado......",0,0,-1,0
65,"excellent done - - open the book and enter a land where fairy tale are true...",0,0.5,1,0.758
66,"have audio verse",0,0,0,0
67,"such a fun series. my kid love it!",0,0.7,1,0.831
68,"somewhat satisfy, not because it actual original, but because if you're someone who read these book a a kid, you'll recognize bit from the "" sup special "" and the "" [ name's ] book "" edition, and it cute. so yeah.",0,0.3,1,0.923
69,"e",0,0,0,0
70,"aft have read ( and love ) all the ivy + bean book with my 6yo, i found this real appoint! the writ i stilt and just - odd.",0,0.1,0,0.493
71,"# nc own in paperback. fs: "" mary lennox was a sour little girl. "" l: "" everything she had hop for them had at last come true. """,0,0.4,0,0.674
72,"katie's neighbor mrs. muddle declare more holiday than anyone else, and she celebrate them in style. in march, she make peanut - butter - and - birdseed cookie for the bird to enjoy on first robin day. the next month, she and katie dance in the rain during first show of april. a the year goes on, mrs. muddle create a unique holiday for each month, and all of katie's friend get in on the fun. then katie come up with a special holiday of h own, and mrs. muddle day i the biggest celebrate h neighborhood ha ever seen! the particular joy of each season are brought to life in lively, entertain watercolor - and - ink illustrate by thomas f. yezerski. subject: holiday - - juvenile fiction. neighborliness - - juvenile fiction.",0,0.543,0.684,0.992
73,"i don't real love the human - like animal story, so i knew this one was probably not go to be a favorite. that bee said, i was actual rather enjoy this one. a little ridiculous, but charm. i was on board up until the bird leave, and then i felt like the book complete rail and total lost me. a solid round of wtf, serious?! until the end...: /",0,0.091,0.556,-0.31
74,"the illustrate in this are precious. the text i sweet and comfort",0,0.4,1,0.848
75,"sm",0,0,0,0
76,"a true and beautiful story / memoir.",0,0.5,1,0.772
77,"it not essential but i love the film so it was fun!",0,0.7,0.333,0.918
78,"read i with my daughter and she love it",0,0.6,1,0.637
79,"podcast search re - read",0,0,0,0
80,"this i such a heart warm story. i just love it?",0,0.4,1,0.727
81,"i receive a copy of this book from macmillan children publish group via netgalley in exchange for an hon view.",0,0,0,0
82,"read for storytime september 14th and 15th theme: dog",0,0,0,0
83,"sm",0,0,0,0
84,"my broth got this book a a present when he was a baby. we had the first edition ( apparent ) because the illustrate on the cover ha three kid snuggle under the cover and the first page illustrate i a little different than the 198os verse. this i basically the b ever children book. the illustrate are wonderful and bizarre. apparent there i a verse with quentin blake a the illustrator. hi illustrate are also wonderful and bizarre but in an utter different way. a few year ago when i went look for a copy of this book ( because a the first sibling to have a kid, i got my brother copy. now that he ha a kid i need to send this book on ) and they were above $200. now the price are much low ( more people look to sell them? ) so you should make sure you get your kid ( or your adult who like poetry and sleep and whimsy ) a copy.",0,0.286,0.556,0.867
85,"i like this book, and i show the weston wood film of it at least once a year, and my library even ha the matching stamp to stamp the kids' hand / paper, but i have to admit i don't entire "" get "" it. i mean, what i go on with this bear live situate? he seem like a child, yet he out and about in the middle of the night, canoeing across the lake and climb mountain in the dark. where are this bear parent? why doesn't he wear a life jacket? so many answered question.",0,0.25,0.5,0.86
86,"e",0,0,0,0
87,"i've read the first two in this series and am very excite for the next book!",0,0.6,1,0.57
88,"mini me corn view will be post on the blog late this week.",0,0,0,0
89,"i didn't love this one, though i will be interest to see what my kid think and how it fare on a second read, or outloud. i just couldn't get in the groove of the poetry or figure out if it was all one poem, or four, or each page on it own. the imagery was love, and the illustrate complement the language nice, but i found the highlight of the color word distract.",0,0.333,0.667,0.56
90,"i love it!!",0,0.6,1,0.699
91,"to read: during first grade and second grade school visit.",0,0,0,0
92,"los lectores de juvenil de nuestro pais no parecen muy predispuestos a lee libros de relatos. suelen preferir encontrar novelas que los atrapen en una historia lineal que los lleve a devorar pagina tras pagina en busca de un final inesperado. y eso e algo de lo que las editoriales espanolas son conscientes. por ello, que una de ellas publique como una de las apuestas de cara a la campana navidena un libro de este tipo no ha llamado la atencion. no ha parecido un movimiento arriesgado digno de detenerse a leerlo... aunque solo sea durante medio minuto. seguir leyendo: http: / / www. eltemplodelasmilpuertas. co...",0,0.04,0,-0.645
93,"i am not sure what to do with this one. i definite like the end. i think i need to re - read it. felt more like a tale for adult than for kid.",0,0.4,1,0.663
94,"this i a great story for kid, and a work of art!",0,0.6,1,0.659
95,"my biggest beef i with the f chord in the music at the end...",0,0,0,0
96,"my boy and i love read / listen to kate dicamillo book together, but this one was for a young kid.",0,0.6,1,0.382
97,"o",0,0,0,0
98,"i just couldn't get to this book. there wasn't enough tense to make me feel like i had to know the outcome. i didn't even skip to the end. i could see the similarity to wizard of oz and pet pan and narnia, but perhaps i'm just too old to read this now for the first time.",0,0,-0.333,0.311
99,"read this view on kk's book and view my daughter and i read this together and neither one of u real like it. it a dnf for u both. that bee said, a lot of what i didn't care for was the author voice. my daughter was bore with it. she didn't want to read it aft the first chapter. so i start to read to h, which we do every night aft silent read. even that didn't entice h. since neither of u enjoy it, we decide to move on. i'd like to say she too young for this book, but she enjoy julie kagawa's winter passage which i for an old audience. i'm not real sure why this didn't work for h, unless like me, the writ and author voice didn't work for h. in fact, she actual didn't feel comfortable writ a less - than - favorable view, which i why i am. * * * arc courtesy of random house children via netgalley",0,0.3,0.538,0.849
100,"o",0,0,0,0
101,"there real i a book for everyone!",0,0,0,0
102,"beautiful illustrate, fun and funny. and i don't get it. the fog just need people to notice it for it to go? isn't there a mobilization step in there? if i understood it, this would be very high rate, but i can't g a high rate for a kid book that i don't understand. ahhhhh maybe i'm just stunned.",0,0.45,0.333,0.65
103,"cute, entertain read. another great book by neil gaiman.: )",0,0.5,1,0.856
104,"hnwzm yn khtbw b jwn dl my khwnm b yn tfwt khh wsh y khw hrzdh y glm ( hwr ) khh 7 slshh. khd mhdy adhr yzdy rw ngh drh wsh y bchh hy khwb dyrwz w mrwz",0,0,0,0
105,"this book i a delightful introduction to impressionism. my kid were not a interest in it a i was, though. maybe when they're old?",0,0.2,1,0.48
106,"little kid action: my children love this book, especial learn about the animal. the story was written in a way that was high accessible to the kid. they understood that pollute i not good for the animal, and why they could not cross a busy highway. they love the illustrate. i did not delve much to the fun wildlife learn at the end. that i probably better for 6 - 10 year - olds ( a high ratio of text to illustrate ). big kid action: i love this book. i have a soft heart for endanger specie, and this book real bring aware to the plight of animal at the hand of human develop. i love that we get to know the animal through their conversation, and they tell u "" in their own word "" what they are go through, first - hand. the illustrate are colorful and fun, and help bring the story to life with a rich and biological accuracy. this i a great start point for even the young children to learn about and appreciate environmental conservation and respect for the world outside of the human population. to read our full view, go to the read tub ( r ).",0,0.4,0.714,0.992
107,"senora y senores, put your hand together for the fantastic, spectacular, one of a kind... nino! fwap! slish! bloop! krunch! he take down hi competition in a single move! no opponent i too big a challenge for the cunning skill of nino - - popsicle eat, toy love, somersault expert, and world champion lucha libre competitor! subject: wrestle - - juvenile fiction. monster - - juvenile fiction broth and sister - - juvenile fiction imagination - - juvenile fiction",0,0.267,0.167,0.962
108,"when i was a child i like it",0,0.4,1,0.361
109,"this i not, a you might expect, the story of saint george and the dragon. nope, george here i a little mouse, timid and clumsy. but when a dragon roar onto the scene, george brave run against him, and thankful, the dragon i afraid of mice! told with spare word ( one line p page ) and gorgeous painter image, this i one i'll probably introduce my 18 - month - old to relative soon.",0,0,0,0.952
110,"o",0,0,0,0
111,"e",0,0,0,0
112,"i don't know if i read this a a child or not - it certain didn't re any bell, or produce any vivid flashback, a i suspect "" midnight i a place "" will. enjoy, some interesting jump in the story though - like in a film where you sit there go "" hang on, did i miss something? "".",0,0.133,0.6,0.584
113,"e",0,0,0,0
