"id","text","rating","afinn","lsd","vader"
711,"love the series! all three baudelaire's are smart, create, cunning, and fun in their own way. mr. poe i start to leave a sour taste in my mouth though but i have a feel that how i'm suppose to feel with the dramatic irony. there are so many obvious sign though! for example captain sham!!! literal count olaf i shamming him! oh well onto the next fortunate event.",4,0.267,0,0.925
712,"great book for baby / toddle storytime! the kid love participate, do all the the hand can do!",4,0.6,1,0.92
713,"this was an interesting book, some of the tree i knew about and other i learner from. this would be good for start search on plant or to have during a tree it to show some life cycle differences.",4,0.5,1,0.681
714,"such a beautiful book that help little children to understand that their love one may be at a better much nice and kind place. <3 the draw are the most beautiful image i have late seen in a book. i love this book.",4,0.525,1,0.985
715,"# quirky # fun # humor cowgirl take care of h horse and in turn the horse give h # adventure! # youngreaders # picturebook # bookreview # childrensbooks # amreading",4,0.5,1,0.88
716,"a cute story about a mute swan who learn how to play the trumpet so he can communicate. i have no idea why this one not a popular a e. b. white other two book.",4,0.267,1,0.219
717,"what a fun collection of poem about book! a great variety of poem, some short, some longer; a great book to share with young word - love.",4,0.56,1,0.96
718,"quirky kid, puzzle, and adventure - i love this book. i think it length make it a summer read for many overbook children, but it i a story that i would glad commend to any boy or girl start at about 3rd grade level.",4,0.5,1,0.902
719,"4.5 star "" wo's a crowd when pet and hi four - year - old broth fudge are in the same room. grownup think fudge i absolute adore, but pet and hi pet turtle dribble know the truth. fudge i actual a tiny terror, cause mischief everywhere he goes. "" ( from amazon ) i love this book and could not wait to get the other book in the series.",4,0.1,0.5,0.643
720,"the author of press here turn with another simple and charm book. here the entire book i base around the shape of a "" blop "" which i something like a four - leafed clove, or a flower, or a butterfly. with just a few word on each page, the young read will cover a world of blops between these cover. there are blops of different size, different color, and they do a variety of the too. concept are taught clever, such a mix color, what appear in a mirror, and opposite. while there are punch - out page at the end of the book, this would still make a great pick for library to circulate. i was particular please with the mirror page and color mix page that add a special twist and fun to the book. another great pick from tullet, this book belong in library collection and would make a great toddle read. expect to be draw and seeing blops afterward! appropriate for age 1 - 3.",4,0.525,0.455,0.982
721,"amaze and sup tail illustrate - i had a lot of fun look at all the small tail in each picture. the story was very cute, too, but the illustrate are what make this one.",4,0.533,0.5,0.675
722,"flora i a self - proclaimed cynic and a fan of the comic the amaze incadesto. she live with h mom who write romance novel. one day h neighbor get a new vacuum; flora see h neighbor vacuum up a squirrel outside. thus begin an amaze adventure. it seem that the squirrel ha sup power; flora name him ulysses aft the vacuum that suck him up. flora mom doe not want the squirrel, but flora doe and i able to talk to him. flora mom try to get rid of the squirrel, but flora dad step in to help out. ulysses develop hi own sense of superpower and decide that he need to help fend the defenseless. flora and ulysses have many amaze adventure together, meet some strange new character, and learn who i a friend and who i an arch - nemesis. some of the text i done in graphic novel format, which make for an interesting read. this i a funny story with plenty of action and odd event.",4,0.22,0.444,0.983
723,"lucky enough to receive a sign arc. i real enjoy this book and think the short chapter would make it a good read for a reluctant read",4,0.533,0.5,0.785
724,"i was a little underwhelm to read this last book because i had heard it wasn't a satisfactory end. i think it might be because go to this book those people who thought that were expect some harry - potter / animal - house / they - grew - up - and - got - marry. - he - a - doctor. - she - a - lawyer kind of end. but in reality, life i a lot more complex than that and i think daniel handle capture that sentiment real well. there i no point where your own story i over and the re of your life i just an epilogue. beatrice was dead before the series even start and it can still be thought of a h story. essentially, i think the overall sentiment of this book i that everyone story i also a piece many others' story a well. i'm quite sad to be done with this series.",4,-0.2,0.2,-0.891
725,"bernard waber's book would work well in the secondary classroom a an in - road to conversation regard "" courage. "" it would also work well within a lesson on classify a different "" kinds "" of courage are explore within the book. thank you, franki sibberson for commend this book a part of your choice literacy article about vocabulary instruction.",4,0.4,1,0.933
726,"in this powerful written and illustrate picture book by gift storyteller patricia polacco, read are taken back to the civil war. sheldon curtis ( say ) i lye near a southern battlefield. when pinkus aylee find him, he carry the wound boy back to hi mother house. she nurse him back to heal, and the two boy become friend. tragedy strike, and a they're on their way back to join the ion troop, they are capture by federate troop and separate once they reach a camp for prison of war. the story i fill with poignant moment and hint of the dignity of slavery. even though pink was that rare slave who had been taught how to read by hi master, he was certain that he had done so for hi own convenience and not out of kind. the author / illustrator mind read that heroes can appear in the most likely place, and that a debt owe to someone for save one life i a debt that last even aft death.",4,-0.059,-0.053,-0.939
727,"4.5",4,0,0,0
728,"i read this with my boy a while back, then forgot to view - doh! this was a very well - plotted, novel idea for a kid book. in particular, my two love the ' what the poe twin didn't know ' section at the end of each chapter, plus the chapter with edgar allen poe's ghost ( mr shakespeare was particular amuse! ). one minor quibble - the language and sentence structure was very sophisticate throughout, and in place, this made it a little dry. however, that aside, it was an absolute genius concept, very quirky and original. we like it!",4,0.233,0.2,0.939
729,"last month, i read this book at one of my fave bookstore. this book was special design for pink - love, since all that i could see was pink. baby pink, hot pink, soft pink, dark pink, even magenta! hehe nice book btw.",4,0.6,0.5,0.917
730,"i member seeing the black - and - white film of this on vhs when i was in the 7th grade, so i thought it'd be fun to read the book. it a wonderful story that still relevant today, with humor and love and a real important lesson about letting kid be kid and not doubt the right away.",4,0.467,1,0.945
731,"the work of nasrin khosravi serve to preserve and publish and celebrate at every opportunity. dreamy chagall - esque layer of color, impasto, pencil underlay, spot of gilt - g me a big book of that!",4,0.4,1,0.778
732,"this book for me ha help fine what it i to imagine. pet pan isn't on a book, but a world.",4,0.4,1,0.45
733,"i got this a a present to g to someone at christmas. it i a real funny, charm book that i fill with a hilarious picture and ha a great sense of humor.",4,0.533,1,0.942
734,"grandma like to take in various animal and g them a good home but she swear on h life that she'll never take in any elephant. she deny the elephant several time and h house start to get a little crowd with all of the other animal but she hold h ground. will she even let the poor elephant inside and g him a good home? this book i one that kid will enjoy for quite awhile and will help with read skill. it also ha a good message about think about your own prejudice, which grandma ha to face eventual.",4,0.236,0.273,0.909
735,"you can accomplish a lot if you have confidence in yourself. and even the mighty mighty monster have to be mind of that from time to time.",4,0.4,0.333,0.727
736,"this isn't a book for children unless they're old enough to recognize the humor in the seeming atrocious character of mr. crow. this story was written almost 100 year ago by one of our great dystopian storyteller. i'd have been appoint if it were a tale of fluff. there i a lot to be analyze and cuss within this text, include gender role and relationship, however, consider that this story was written a a christmas gift to huxley's niece. it was publish posthumous and was not written specifically to be publish. it was written in a time when women were treat like silly creature to be own ( even more so than today society ). perhaps this was nothing more than a tongue and cheek story meant to bring laughs with the nasty character and the silly of crow live in a tree but shoppe in a grocery store? the absurdity of the oblivious husband aware hi wife egg have been miss for a year? or perhaps it i a tale favor wisdom over violence? this i not a story full of role model for your children to emulate, but it i a story that will open up a discussion.",4,0.036,0.091,0.827
737,"creo que e la mejor edicion de alicia que existe en espanol. por do cosas, el precioso trabajo realizado, contando con los grabados originales de los libros y segundo por el trabajo de traduccion y las notas tan trabajadas que hacen ma entendible la mente que dio vida a este cuento tan maravilloso. sin duda no dejas de sorprenderte, aun conociendo la historia, de la creacion de lewis carroll; su pais de las maravillas esta creado para entretener, riendose de los viejos poemas moralizantes, sino que ademas te invita a sonar con y a plantearte cientos y cientos puntos de vista sobre una misma verdad. la recomendacion de este libro se vuelve casi obligatoria, asi que invitados estais a ello.",4,-0.2,-1,-0.7
738,"f - year - old pelle - goran, who i ordinarily a very well - behaved little boy, ha begun act out a a result of hi mother recent jury which ha kept h fine to a hospital b. though hi mother i expect to cover, pelle - goran's father think it will be better for everyone if pelle - goran goes away on a holiday to hi grandmother house. while visit hi grandmother, pelle - goran get to know hi cousin, kaja, who i an orphan, a well a a variety of colorful character who live near the farm. while hi mother convalesce back home, pelle - goran help to unite an estrange grandfather with hi grandchildren, discover whether dog can talk, and learn to make a spettecake, the gift he ha promise to the doctor for cure hi mother. this novel, translate from swedish and set in sweden, i a charm story of the same variety a the good master, wherein a child step out of hi comfort zone and begin to grow up a a result of the experience. pelle - goran, though seeming obnoxious at the start of the book i actual a sympathetic and sweet protagonist. hi concern for hi mother, a well a hi innocence about farm live, make it easy to root for him, and hi friendship with cousin kaja i a strong element of the story. because pelle - goran like to hear story, there are also a few swedish folktale intersperse throughout the novel, which g the book a little extra cultural flavor. though much of the story feel universal, and could happen on a farm in any country, these folktale help to g the american read a little insight to swedish custom. the spettecake holiday wasn't exact the kind of book i had in mind when i first chose family story a this month theme for the old school kidlit read challenge, but it wind up bee a good fit. not on doe pelle - goran worry for hi mother, but he also grow close in affection to hi grandmother and cousin and witness and help to solve the difficulty between two of the neighborhood children and their own grandfather. the story itself i large episodic, and sometime i found myself wonder if anything was ever go to happen, but what seem to be at it heart i the importance of family and the value of their support in endure childhood difficulty. overall, i found it to be an enjoy and gentle tale, appropriate for read aloud to kid a young a f or six. in addition to the good master, the spettecake holiday would also pair well with the 2015 novel, adventure with waffle by maria parr, which i set in norway and i also a work of translate. this view also appear on my blog, read - at - home mom.",4,0.329,0.628,0.997
739,"what a fun read this chapter book i. children will love the funny and strange land where dog talk and time machine are not heard of. this was a cute book with many adventure for christopher and sophia. clever written with humor and over the top character name it was a fun read. each chapter was ale with event to keep the read engross. i am glad that i was provide a copy by the author to view. it i well serve of the 4 star. it i a gem of a chapter book.",4,0.491,0.833,0.98
740,"this i a cute children story that teach a lot of good lesson in a short few page. i love nimpentoad's resourceful and also the good teach moment that young children need to hear. for those with young kid who love a cute adventure, then this book i for you!: )",4,0.514,1,0.971
741,"good for grade 3 - 6",4,0.6,1,0.44
742,"i receive this book through netgalley in exchange for an hon view. it i universal known that all young children go through the ' question ' stage. for those fortunate enough to have yet to experience it, essentially the child ask a string of question, most of which are simply "" why? "". it cute at first, but you can on answer why so many time. this book take that sire to question everything and spin it around. by ask sup - silly question about everyday life. a a parent, not on do i enjoy the new question that are bee introduce, but i ( secret ) love the lack of ' why? '",4,0.2,0.6,0.912
743,"a good message about bee kind and accept of other.",4,0.4,1,0.836
744,"i like this book. it isn't necessary in regard to wonder, but it i nice. it didn't read like fan fiction even though objective that what it was. i especial like the story from charlotte's perspective since we didn't real get an in - depth view from any girl in wonder. middle school, ugh, i would never go back there. i also like the bit of explanation about the award auggie was given. overall a cute and at time surprising deep book.",4,0.475,0.75,0.939
745,"i absolute love these mr men and little miss book. i member getting them from my granny every week. there was so much from these simple character, i member fill my little bookshelf with all these book make sure i had got them all in right order. i wish i still had these book but somehow most of them got lost with many house move or my mum gave the re away. if i ever have kid, i will make sure they get the chance to experience these wonderful, colourful book.",4,0.167,0.5,0.91
746,"excellent life story. i'm glad there a format for this age group.",4,0.6,1,0.772
747,"love it! but i real need to keep read book in english, translate just dont make it coherent",4,0.6,1,0.439
748,"i love the underneath and enjoy this book so much",4,0.5,1,0.813
749,"inspiring. funny. absolute tear - jerker. great read for any age. can't wait for the film.",4,0.667,0,0.869
750,"the pires are curse with new neighbor. the were just fine on nostfer avenue until the wolfsons arrive. there seem to be no end to the new family strange ritual. they stay up all day long, lock their window at night, and bathe - - in sunshine. what a nice vampire family to do? ross collins ha create an ironic, laugh - out - loud story that invite you to think about accept other - - perhaps your neighbor are less different than you think.",4,0.145,0.143,0.878
751,"i may have like this even more than basho and the fox.",4,0.4,1,0.361
752,"a a kid i try to read this book a couple of time since it mind me of little women ( my favorite book back then ). but too bad, i couldn't stand anne. she talk too much and then there was the god talk that i found pretentious. luckily now i could see past all that and not to take everything so serious.",4,0.15,-0.333,0.353
753,"i actual have a mass stack of unread book from my last trip to adelaide last year, and this was one of them. i am determine to make a dent on my ever expand pile of unread book, and constance savery i always high on that priority list. h book are never ground break, but they were cute, quick story about a time in history that for me i special. i just love book set around the board school ideal, and although this one quick take the two main character away from that sett and on holiday, there i enough of that element to keep me happy. four star, please check out some of constance's other book a well!",4,0.4,0.5,0.988
754,"a love little book - i know my son ha taken to it a he kept explain bit in advance for me!",4,0.5,1,0.784
755,"summary: ivan i an easygoing gorilla. live at the exit 8 big top mall and video arcade, he ha grown accustom to human watch him through the glass wall of hi domain. he rare miss hi life in the jungle. in fact, he hard ever think about it at all. instead, ivan think about tv show he seen and about hi friend stella, an elder elephant, and bob, a stray dog. but most ivan think about art and how to capture the taste of a mango or the sound of leave with color and a well - place line. then he meet ruby, a baby elephant taken from h family, and she make ivan see their home - - and hi own art - - through new eye. when ruby arrive, change come with h, and it up to ivan to make it a change for the better. plot: to me, this plot was so simplistic, but so relate. a an animal activist, i complete get all of the trouble the animal face in a mall / zoo. at time it was sad to think that million of animal have to go through so much worse than what was face in this book. i hope the one and on ivan made people realize what a terrible idea it i to lock animal up in tiny cage or habitat. writ: i went to this book think it would be a middle grade book with small font. instead, i got a children book with the large font. which i total fine. even though the writ was very simplistic and for children, i still real enjoy it all the same. in a way, some of the "" chapter "" ( they were on one page ) were poetic and could be consider poem. character: i real enjoy all of the animal in this book. of course, they didn't have any depth, but it was still fascinate to see the world through ivan's eye. overall & commendation: i would commend this for 2nd+. this was a cute, love story that i perfect for all age.",4,0.14,0.391,0.987
756,"i read this book to see what all the hype i about, because my student ( i'm an elementary school librarian ) all love bad kitty. and, i'll admit, i real like it, too! i enjoy the conversational tone of the narrate and how the narrator spoke directly to bad kitty. it force the text and illustrate to work together and encourage the read to "" read "" the illustrate and not gloss over them, much like a graphic novel. i also enjoy the fact that were intersperse throughout the book. there was information about different kinds of vet and what they do, a well a how you can tell your pet might be sick. however, all of this i present in a way that i funny and easy to understand. i now understand the fascinate and will continue to commend bad kitty to my student, especial reluctant read.",4,0.162,0.4,0.962
757,"chris demarest both wrote and illustrate this picture book deal with read. a stone lion, becoming bore with guard the public library, sneak inside to see if it i worth guard. he find that it i. the story and the picture were both enjoy and light hearted. bright water color picture reflect the bright cheery story. the picture extend the story by show children read and use the card catalog ( do card catalog exist anymore?.... story worthwhile for that fact! ). the kid in the story are have fun at it, too.",4,0.3,0.4,0.96
758,"i read this book for this month storytimes and it was quite fun. it got a little tedious for some young and / or squirmy audience, but the kid did get to roar! it also got tedious from my perspective since i had to read it so much - - it not one i'll read often again unless i need a book like this. for: storytimes about lion; read want a book encourage participate. possible re flag: anti - dog.",4,0.32,0.2,0.831
759,"this was a good book",4,0.6,1,0.44
760,"m. lowry ha done it again, make an ordinary situate, quite extraordinary, and turn the endear and enjoy story of a church overrun by over two hundred mice to a delicious and entertain morality tale. what make a cat, a dog, even a rabbit a love little pet, while a mouse i a fear, obnoxious p? when it i time to bless the animal, are mice to be exclude? read how these mice outsmart the great x to receive their proper bless. all of g - d's creature serve our respect and protection.",4,0.178,0.529,0.968
761,"draw! by raul colon - wordless picture book - powerful beautiful book. young boy sit on hi b and start draw... the draw transport him to visit an elephant, rhino, and many more creature. love the interaction the boy ha with the creature. fantastic illustrate. quite wonderful book, high commend.",4,0.571,1,0.976
762,"greg, you are total fantabulous; )",4,0,0,0
763,"great tense for kindergarteners.",4,0.1,0,0.402
764,"i can't wait to see this movie depict on the screen this year. it i a good book and also great for a book club / study a there i so much that you can cuss.",4,0.6,0.333,0.791
765,"i found it more amuse than my previous read of dwk.",4,0.6,1,0.458
766,"the play on word i so fun... it just nonsense... very relax.",4,0.2,0.333,0.757
767,"adams share a holiday book to introduce classic literature to baby! color and object are highlight by christmas carol character. view from a library copy.",4,0.3,1,0.764
768,"see my view at http: / / www. littlebooksontheprairie. wo...!",4,0,0,0
769,"just a fun a the first one, and if anything greg actual seem worse. it was nice that rodrick's character was expand upon, but it seem to be at the expense of some of the other character.",4,0.25,0.5,0.392
770,"franklin search for what would make the b birthday present for hi mom. aft talk to each of hi friend, he final come up with a wonderful idea!! very sweet story.",4,0.6,1,0.895
771,"the genius file i a rollick new series about twin broth and sister coke and pepsi, who have been recruit a part of a group of high intelligent kid chosen to help solve the problem of the world with a fresh, kid perspective. this book ha something for everyone. there i action and humor from the get - go, in addition to ton and ton of interesting bit of information that any fact - collect kid will devour. ( see full view here: http: / / www. storysnoops. com / tail. php... )",4,0.25,0.556,0.906
772,"oh rebecca! a a child i felt myself to be like h ( though i was certain more ungainly among my year - mates than she ever was ) in the lively imagination... and rebecca and h colleague pollyanna taught me to pay attention to the beauty of life, to other people ( no matte how dull one might think them at first ), and to believe in happy end. so, at least in my childhood, this book serve the purpose for which it was written. re - read it a an adult, i still found myself weep a bit over poor rebecca's action to bee scold at h hour of triumph. while misunderstood betsy and anne of green gable came late, i have to think that rebecca carry more of my heart than anne, let alone betsy - - caddie woodlawn outstripped them, and of course laura ingalls. i want to be a strong of purpose and a useful a these young girl, knowing that i too came from a background that would quire hard work to rise from; i want to be respect in a way that was already outdated when i learn of it. perhaps have these sort of role model ( however subconcious ) made me a little odd and stiff, and certain foster in me a self - criticism that perhaps my pee didn't have. certain the idea of what a child could and should do to support the family i took from these were old - fashioned then, and still more now; in fact, the kind of upbringing these girl had - - and, for stance, the pepper ( and how they grew ) would be consider child neglect nowadays... but i grew up responsible, so it wasn't all bad, and it help me to weather some bad time. wiggins' writ of the beauty of nature, despite it 19th century new england fancy, still touch me; if i could teach my son to see the that way, i would be please: ""... there a brook, but not a common brook. it ha young tree and baby bush on each side of it, and it a shallow chatter little brook with a white sandy bottom and lot of little shiny pebble. whenever there a bit of sunshine the brook catch it, and it always full of sparkle the livelong day. "" spoil: a rebecca become a teen, there i an old man who take an interest in h, and some read not nurse on 19th century literature will probably be appall; but unlike, say, daddy - long - legs he make no move and show no overt interest, i think we can forge him for an attraction that was willing to bide it time.",4,0.058,0.2,0.983
773,"cuuuuuuuuuuuuuuute",4,0,0,0
774,"princess clarice ha a special pet, thaddeus f. whisk, a cute kitten who i quite intelligent. he i put to banish by a wizard, but escape to the wilderness and a great journey. fun story, great for young adult.",4,0.35,0.75,0.974
775,"nice book for kid or even adult.",4,0.6,1,0.421
