"id","text","rating","afinn","lsd","vader"
530,"i think this i an enjoy, solid easy read with a witch theme. my second - grade daughter read it to me and we enjoy the story together. lulu witch i very believable and act the way most children would when a young sibling destroy their stuff. she get mad and say that she hate witch baby and then sneak to the forbidden magic room to try to find a spell to make witch baby appear. she late regret this aft h anger ha cool. i think most kid could relate to lulu and h adventure. my daughter like it well enough to ask for the second story, lulu goes to witch school.",3,0,-0.333,-0.893
531,"3.5 star",3,0,0,0
532,"the setup make no sense - we see lot of kid in the same city / town wake up, but from then on all the sound are to found nowhere near these kid. i understand that the book i suppose to focus on all the different habitat around the world, but what would make sense for the given setup i to show all the sound happen in and around that city / town that the kid could actual hear. "" good morn, little one. can you hear the sound of our world? list! list! list! "" "" well, i listen and no, mommy, i can't hear any of those. "" what the point?",3,0.067,0.8,0.653
533,"i think i miss out by not read this first a a child. on the one hand, i enjoy this story of why rainbow never touch the ground and why there are so many beautiful, colorful bird. on the other hand, the goblin were nasty for no real reason. they don't learn their lesson, either, they just get kill. the illustrate, however are gorgeous. they're production of oil paint, and they are stunning, a realistic fantasy world, if that make sense. i can see why so many member this book from their childhood. it original, both the story and the illustrate, although i don't think it would have been a personal favorite, a little sad for me maybe.",3,0,0.333,0.895
534,"the polar express was special at my house, because it was not house on the book shelf with the regular book. it was pack away with the christmas decorations to be forgotten and discover every year.",3,-0.2,0.5,0.202
535,"whenever h neighbor have problem or concerns, celia i the one that list to them. since they pay h with a seed, one small boy figure he can't get rid of hi sorrow because he lost hi seed. aft scatter the seed of sorrow in happy way, celia find julian's seed. together, they plant it, nurture it and watch it grow to something bright and happy. i'm not sure that i agree that happy spring from sad, but i do find the book message of affirmation assure a well a bee please to be mind that life always contain joy and sorrow. i some respect it must be hard to be celia, always hear those sad story from other.",3,-0.025,0.158,0.86
536,"charlie take hi mom on an adventure. lot of imaginative play. i appreciate the depiction of a young boy who like car but i also cool with paint hi mom nail and taking h dress shoppe. a bit long and read more like an parent would enjoy it.",3,0.367,1,0.942
537,"this i basically a polite press advice book from the author of a series of fortunate event. if you have read the book, you know: he not actual kidding when he tell you uncomfortable, terrible the are in the book, and this book ha some of the anti - platitudes you might expect to see in that series ( but apply to life outside the fictional universe ). while i prefer the story, it still just a ton of fun to read through these and snick and feel sort of sad. my favorite quote from the book: "" love can change a person the way a parent can change a baby - - awkward, and often with a great deal of mess. """,3,0.067,0.077,0.913
538,"i'm real glad this wasn't the first sharon creech book i read, otherwise i might not have bother with any other. the book ha a great deal of charm, like all creech's book, but it curious underwhelm: it present u with a young marry couple who seem inept and naive, constant ask each other question that make you want to say: what world do you people actual live in? they seem to have little understand of anything, and it a mystery how they and their farm survive. i almost gave up on the book about three - quarters of the way through, but since there was on a relative short way to go, i thought i'd finish it. it doe end fair well, and the last page are much more heartwarming than anything that gone before. but... but... did these people real need to be so childlike in their approach to everything? it a if they exist without any sense of how anyone else in the world work... enough said.",3,0.26,0.6,0.962
539,"it was so strange written that i often had to reread and reread again to actual find out what was even go on",3,-0.2,0,-0.272
540,"jess plan on bee the fast runner in six grade when he goes back to school in the fall. he spend every morn practice. he just want to be good at something. jess i the middle child in a family of girl and feel like he get the short end of the stick a lot. then leslie move in next door. h parent are hippie and she i a bit different than all the other country kid in the area. on the first day of school, leslie beat not on jess but all the other boy in the race. this doe not endear h to any of them. it take a while but eventual jess and leslie become friend. they start hang out across the creek in the wood. leslie christen it terabithia and name them queen and k. to get to terabithia you must swing on a rope across a creek and then enter the wood. when the creek i up this can be a bit dangerous. life in terabithia i fun and carefree, unlike real life where jess and leslie have to deal with difficulty at home and school. jess's dad lose hi job and the family struggle financial. leslie crave the attention of h parent who are very busy. jess also struggle with the fact that he love art and draw but hi family think it i a waste of hi time. on hi teach miss edmunds appreciate hi talent. this book deal with a lot in a short numb of page. it doe just gloss over most of the tough issue and doesn't real delve to them. there are hint of child abuse and neglect and bully that are not real dealt with at all. the tragedy at the end of the book isn't even given that much attention. sure it i just an accident and no one bare the blame except perhaps mother nature, but you would think there would be more about jess deal with it. what i love about this book was that it show kid bee kid, use their imagination in a way that most adult forget how to do. i member create the most elaborate scenario a a kid with nothing but stick and cardboard box or hay bale. the mind of a child i a wonderful create place and i think we sometime forget that today. we load kid up with toy and electronic gadget and they forget how to use their imagination or be create. it i a bit sad. previous view: i've been mean to read this book for year. i've seen the movie so i knew what was go to happen, but i had never read the book. the book in some way mind me of childhood. play with friend, make the up and imagine the, not need a lot to have fun. i think a lot of kid miss out on that aspect of childhood today; they are too connect to the... internet, media, tv, game. they don't have the imagination for something like terabithia, which i sad. this book deal with some pretty heavy topic, but fortunate it just brush over them. there isn't a whole lot of in depth reflection on some of the topic even the big topic of the death at the end. it was a good book and i am sure for it time it was pretty ground break.",3,0.023,-0.111,0.757
541,"with felina, the evil cat gone, hopper i able to help out hi friend firren and zucker with their brood of young royal heir. well, democratic royal - ish heir, even though the young, hope, real want to be an entitle princess and wear diamond tiara. when off on a jaunt, hope come upon devon, a guard who ha an evil agenda. she i also kidnapped by pup, who i not a evil a he ha seem in past book; more misunderstood than anything. there lot of adventure, running around under new york, and lot of family and community secret that get brought to life, tying everything up nice in this final book in the trilogy. strengths: i'm start to see a bit of a resurgence in fantasy read in my library, especial the variety that involve sword. this i a good choice for read who are transition from erin hunt to john flanagan's ranger apprentice book. weakness: the mice talk. and they wear jerkin. why? why do they wear jerkin underneath modern new york city? why this elaborate pseudo - medieval power structure? make no sense at all. why not 1920s gangland rat and mice? tommy gun instead of sword? fedora instead of cape? what i real think: a much a i love cute cartoon mice in easy read, i like talk, war like mice in the like brian jacques. just a personal preference; this series circulate well.",3,0.125,0.31,0.982
542,"cute twist on an old favorite! love use these with kid - aft they know the original of course! great discussion on how they're different, which they like better, why the change were made, etc. love the tail in this one, like that there was a "" kid "" name goatilocks ( because young goat are call kid! )",3,0.475,1,0.983
543,"a collection of seek and find puzzle for school - agers with rhyme text and bonus challenge. this i a b - of from the i spy series so dedicate read will recognize favorite scene.",3,0.1,0.333,0.778
544,"great, compelling story. will appeal to hp fan.",3,0.6,1,0.807
545,"hewitt i a tiny boy born to giant. hi parent worry overmuch about him, a size real doe matte in their world ( which i real small - minded of them! ). hewitt come through in hi own way, prove hi worth even if he not what hi parent expect. great picture, cute premise. i feel like i've seen variate on this theme before so nothing stood out other than the idea that the family i gigantic ( with the exception of hewitt ). i love how they sing, and the overt play of love and affection they have for each other. this i perhaps the true value of the book - show a genuine car family deal with a situate that seem more upsetting than it real need to be.",3,0.3,0.667,0.975
546,"we took age to read this aloud and like it alright. we both want to know more about lewis and clark so that great inspiration. also my son cringe and ask me to skip ahead during the worst bully scene which tell me it translate very effective! i also like abigail's response in this scene too.",3,0.175,0.2,0.894
547,"zelly desperate want a dog. h grandfather, ace, who speak in all cap, convince h to get a practice dog. she name the practice dog, o. j. since he i actual an orange juice bottle. it hard to carry around a pretend dog when you are go to 6th grade and try to fit in to a new community. to make matte worse, h b friend i at camp and she ha no one to hang with. i like zelly. she i a believable character with issue typical of a 5th / 6th grad. a fun, quick read.",3,0.036,0.4,0.778
548,"classroom library",3,0,0,0
549,"the joke and language are more for adult than kid. but the kid will like the bright, wacky illustrate, and the goofy, happy end, complete with a fold - out page of the fox sneeze out hi victim.",3,0.2,0.6,0.902
550,"a bit sad and press. poor little boy i strand.: - (",3,-0.4,-1,-0.735
551,"fun concept for a picture book, but the execute i so chaotic that the story suffer.",3,0,-0.333,-0.853
552,"a tell of the jack and the beanstalk story. jack and hi mother own a burg cafe that suffer for busy once the new sup highway i built right over top of their little eatery. when they are down to their last few penny jack mother send him to the store for some coffee bean, but along the way he meet a strange who sell him some magic bake bean. the magic bake bean produce a beanstalk and at the top of the beanstalk i a nice giant who love to cook! this verse of the folktale off a few nice variate and a happy end. it a reimagining worth explore. the illustrate are well done and look like movie still. thye food i depict so delicious that my mouth was water by the time i was done read. too long for a read aloud, but commend for new dependent read familiar with the folktale.",3,0.345,0.429,0.989
553,"skellig i a good name for that something. it from beyond and different. and thin. hey! i real learnt something from this book: about bone structure and about these shoulder blade. nice story for a one - day read. warm you up inside.",3,0.467,1,0.784
554,"kind of a silly book. my 3 y / o just kept ask "" why doe the book eat people? """,3,0.1,0,-0.046
555,"menurutku translatenya aneh yang menjadikan gaya bahasa menjadi aneh. tapi overal ini termasuk buku anak - anak yang menarik sekaligus hambar bagiku.",3,0,0,0
556,"angus mcfangus discover that hi parent don't real work at bore govern job while he live with hi uncle max in devon. angus i whisk away from devon to imbur island and perilous school to learn about weather. angus, dougal and indigo have an adventure look for the lightning vault in hope of getting angus's parent back.",3,0.133,0.429,0.494
557,"giraffe work together to figure out how short one can be in picture too.",3,0,-1,0
558,"the illustrate were beautiful done to go along with the story of what rabbit friend do during winter. they all do something different along with rabbit. was a nice story.",3,0.6,1,0.872
559,"it encourage to find a picture book feature a young girl who seem to challenge many assumption other make about what girl should fear or how they should behave. in the case of poppy louise littleton, she like snake, monster, and scary story. life truly an adventure with this seeming fearless girl. to h sister petunia surprise, she not even afraid of the dark base. but one day she find something that doe make h nervous, and she need some help to deal with that fear. although the story went on a bit long for my taste, it could certain serve a a great mind that everyone ha something to fear, no matte how brave he / she might seem to be. i love the stylize illustrate, which show the characters' facial expression and body language with just the right tail.",3,0.078,0,0.953
560,"are you afraid of ghost? well, if ye, araminta seem to the opposite. she ha been look for h own ghost for year. she live in spookie house, with aunt tabby and uncle drac. one day, aunt tabby want them to move to another place. she was frustated about the boil which likely cause trouble. she thought the spookie house i a little bigger for three of them, she want them to move to the small place that she could handle. knowing that they have to move, araminta arrange the plan to fend the spookie house. she doesn't want to move, she like this house and believe that there are ghost in this place that she hasn't cover. and the adventure begin. i enjoy read this book. i haven't read the septimus heap series before, so i don't know what kind of writ style angie sage would bring in. but i like this. light read, imaginative, funny, and entertain. araminta i such a brave girl with thousand create idea to keep spookie house. the name of each character i funny too, like mr. & mrs. wizzard, uncle drac ( who fond of bat and keep them in hi room ), even araminta spookie itself i a funny name. this book contain many illustrate, like this one: [ image error ] i commend this book to everyone who love read children book, or to parent for your children. this book i the first in a series, and the title of the sequel i the sword in the grotto. i wish i could get the copy soon.",3,0.256,0.407,0.994
561,"mike lester's a i for salad put an interesting twist on the alphabet book. the critter depict in the book ( alligator, beaver, etc. ) follow the normal progression of letter, but the action they are involve in what the letter i "" for "" ( i. e. the alligator i eat salad, so "" a "" i for "" salad "" ). the actual name of all the feature creature are given on the endpapers at the back of the book. i thought lester's artwork ( cartoon ) was fun - - he doe a good job draw action - - but overall i thought the concept was a bit limit. perhaps the silly ha more stay power with the target audience of beginning read, but i was tire of it midway through. i read one view that describe the book a "" an advance lesson for kid who have a good handle on the alphabet but you want to make sure they understand and aren't do it by rote. "" this definite seem true, but without proper selection this book could easily be pick up by a child not so advance in alphabet knowledge - - and it'd be thorough fuse!",3,0.4,0.867,0.984
562,"* * spoil alert * * mrs. piggle - wiggle i a woman who live in an upside - down house and smell like cookie. children love h and she love them. most of the story i parent call mrs. piggle - wiggle for advise in deal with children who are misbehave. one little boy won't eat more than a nibble. mrs. piggle - wiggle suggest give him small & small plate until hi plate i the size of a quarter. then she tell the boy it i hi day to take care of h pony, but he i too weak to do so. he start eat again because he want to be able to do fun the. another little girl ha a fit when she i given a bath. mrs. piggle - wiggle tell the parent not to make h bathe. and aft 3 week, they should press radish seed on the girl while she sleep. when the seed start to sprout, the little girl i so freak out, she can't wait to get in the bath. two other kid can't stop fight. mrs. piggle - wiggle tell the parent to act just like the girl do. but the end of the day, the girl are so happy listen to the parent fight all the time, that they beg them to stop & they promise to stop fight themselves. another little boy wont' put hi toy away. hi mother i sick of clean up aft him. there are many more example of the advice mrs. piggle - wiggle give. overall, the story are very funny & silly & kid would enjoy. it i clear that this i written in the 1940s / 1950s, but that wouldn't' stop a child from enjoy it.",3,0.143,0.13,0.986
563,"kid are ask to study each close - up picture in turn and then we slow see more and more of the image. they get a chance to guess what the image i and a lot of them can do it quite quick. i thought the idea was cute, but the image are pretty easy to guess and the book i very short so read it take about a minute. i could see this bee good for very young kid, but it not necessarily good for a wide age range.",3,0.4,1,0.908
564,"a fun story about getting a little one ready for bedtime. however, i should note that even though i'm give this book 3 star, my two year old would g it 5 all the way. i've been read this book to h non - stop since we got it from the library, so it a hit with the tend audience. the rhyme make it easy to read and the illustrate are cute.",3,0.3,1,0.849
565,"i don't member much about this one, except that monkey i pregnant, and winter i a bad time to foal. i seem to member monkey come to the house, but i could be mix up my story. i know i have this at home though, so i will have to do some check. a i member, i like it a lot, though not a much a some of the other i read again and again, which probably mean that no one die / there nothing too press in it. hah.",3,-0.25,-0.5,0.737
566,"wonderful story with posit christen value. love the illustrate! it a hit with my kid!",3,0.7,1,0.898
567,"deborah ellis interview the children of service member from the unite state and canada on their thought and opine. we learn of their feel about have a parent serve in a war, their life at home and how it diff from the average child, whether they plan to join the military, and what are their goal in life. interview are children of vary age, background, and situate, so the read get a wide spectrum of view. i enjoy read the first four interview or so, but then felt like i was hear the same the over and over. i want to notice what made this child or family different from the previous one and i didn't see much. i can see some becoming bore and not finish the book, but i hope they will at least skip to the last two story. one was an interview with a child whose father die in iraq and another whose father i a conscientious objector to the war. to me, these last one were the most fascinate, and maybe that because they stood out from the other. i did sense an underlying anti - war message from the author, but one i think she try to minimize. i got the feel that she try to be a neutral a possible about the issue. i'm glad i read the book, for it doe g one much to ponder. i just wish i could have been more engage with the story of these children. i g it a ' c. '",3,0.053,0.375,0.346
568,"i bought all the mag until i could read the whole story. the writ i great, character - develop i fab and the plot i would say are a 2.5 / 5 but it still something i want to read again. i haven't read the hardcover ' original ' book yet, just however much if the story i could get my hand on from the magazine that just continue from where the previous story left off of. but i know i will love that too. so.... i just on view for the ttunittuni o chottaaccu series - bit from the mag so.... yeah, i am so unreal. lol",3,0.44,0,0.98
569,"i like the message of the book but i wish the author had a better story the kid could relate to. the read will admire how dedicate and motivate willy i even though he obvious ha flaw other have a hard time appreciate.",3,0.3,0.429,0.971
570,"sure i should have read it year ago ( probably i'd have given it more star then ) but when your pupil read the book you have to do it too: )",3,0,-1,0.166
571,"to me this book was nothing special. i mean it was nothing bad but i felt the tone of it was like a mr men book. it ha trace of humour and if you are read aloud you can do different voice for the animal. children at work seem to real love this book and one or two turn to it again and again so i guess that show that it ha something.",3,0.267,0.6,0.967
572,"ah, sophomore year of college. fun adventure where you go out to an abandon manse and run to scary men ( include a chinaman, the horror! ), with box and bag of powder in the attic. what could be go on????? these girl have no clue! i know it the 30's but still....... nobody think it could be drug? then everybody goes to new york for the holiday where there yet another mystery involve a jewel thief. thank good the alpha delta are on the job! i know i'm make fun of it, but i real do enjoy the simplicity and earnest and naivete of these novel.",3,0.283,0.286,0.978
573,"hound dog true i a quiet, middle grade novel about a girl name mattie breen, who i extreme shy, and worry about many the. she and h mom have had to move a lot, due to change and shift in h mom job, and that ha made the prospect of start fifth grade at yet another new school even more frighten. this time, though, mattie ha a plan. since h uncle potluck i the janitor at the school, she go to learn everything there i to know about hi work and then become hi apprentice so she can avoid have to socialize with h classmate during recess. h apprenticeship to uncle potluck take an unexpected turn, however, and she realize she go to have to face h pee. to do so, she will also have to face some demon from h past and perhaps even try make friend with quincy sweet, an old, cool girl in h new neighborhood. i am have a hard time collect my thought about this book. i real want to read it, since i love a crook kind of perfect so much, but somehow i didn't connect with it a well a i expect. the book ha a lot of real strong element. for example, i love the specificity of mattie's experiences. the very simple of the, such a the loss of a pajama button, or the violate of a private notebook by a nosy classmate, take on a deep and almost describable significance in mattie's life, which real drew h out a a character and provide a lot of insight to h personality and anxiety. i also thought mattie's shyness was one of the strong aspect of the book. i think it difficult to understand the paralyze feel of not knowing how to interact with other kid, and even more difficult to put to word, but urban pull it off. still, though, something in this book didn't work for me. i like many of the individual story thread, but i never felt like those thread form one cohesive whole. i was frequent fuse, particular by the continuous use of the word "" plunk, "" and by mattie's devastate over h lost pajama button, and h need to apologize to it. i could understand h feel well enough from a logical standpoint, but i never got to the point where i also felt them myself. usual, i can get to a child mindset when i'm read a children book, but i never saw mattie from anything but an adult point of view. one of the view i saw on goodreads mention that this book would be adore by adult, but maybe not so much by children, and that the impression it gave me. the writ i strong, even if i wasn't crazy about all of the character, and the childhood difficulty mattie face are the kinds of the people of all age can recognize from their own live, but i didn't connect with mattie, and i suspect middle grade read may not either.",3,0.094,0.045,0.95
574,"the squirrel get ready for christmas. the photo of real squirrel interact with doll - size christmas prop make this a fun book for share with prek - 2 this season. an author note follow the story and give tail about how she achieve the shot contain in the book. the story work, but isn't near a memorable a the artwork.",3,0.5,1,0.542
575,"kid will definite relate to the frog sire to be anything other than what he i and light in the self - acceptance he final feel at the end.",3,0,1,0.625
