"id","text","rating","afinn","lsd","vader"
324,"a rather fortunate out. while i certain understand what the publisher was go for, they should have found a writ a bit more knowledgeable and up to date about the planet in our solar system. while i might agree that a book should be simple and colorful when target a young audience, it should still be factual correct and this was publish in 2016, so there i no excuse for outdated information. my daughter found this at the local library, and i read it to h there. i am glad that i did not take it home, or worse yet, buy it. i will not read it to h again. what the book doe right i in the colorful picture and the layout of the story. it flow well. where it fail i in the information contain within. these bee the issue i have with it: on saturn i shown to have re. pluto i list, and mention a a dwarf planet, but ceres and eris are odd exclude. i can't see a modern book include pluto and leave out the much large ceres. in at least one picture; earth, venus, mercury, and mar are shown to share a single orbit.",1,-0.05,0.286,-0.072
325,"this book was very strange... i read a few page and had to stop wasn't make any sence. usual the caldecott award are great book but not this one. it appear to be, i guess four book in one? but yet you read it a one. each page ha a story on top and one on bottom then on the next the same so four story you are look at but you read it a one? i never figure it out and it was just simply fuse... but then again it may have been just me?",1,0.267,0.333,0.817
326,"not for me... chaos",1,-0.4,-1,0.458
327,"synopsis: "" moonlight i real sunlight! did you know that the moon doesn't make it own light? instead, it receive light from the sun and reflect it to u on the earth. read and find out about how the sun, the star and light bulb make light so we can see. did you know that moonlight i real sunlight? the moon can't make it own light, so it receive light from the sun and then send it to u here on the earth. any child who ever wonder about the fascinate property of light will want to read this classic science title. read will even learn how fast light can travel: from the moon to the earth in less than three second! veteran science author franklyn m. branley's lively text and stacey schuett's new illustrate combine fun fact and hand - on activities in this accessible introduction to the science of light. did you know that moonlight i real sunlight? the moon can't make it own light, so it receive light from the sun and then send it to u here on the earth. any child who ever wonder about the fascinate property of light will want to read this classic science title. read will even learn how fast light can travel: from the moon to the earth in less than three second! veteran science author franklyn m. branley's lively text and stacey schuett's new illustrate combine fun fact and hand - on activities in this accessible introduction to the science of light. "" my view: this book came in a box of use book and it seem like an interesting book with great learn opportunity. fortunate this book took it way to far and became too technical and scientific for the audience. it would have been good if it had just focus on one concept deal with light ( ie. reflection ) but it went to tail of many form of light. munchkin i a little advance and often enjoy non - fiction book but this one was long and fuse for him, it i definite not a book for someone read picture book.",1,0.48,0.909,0.984
328,"all of the book in this series up to this point were original story. none of them were amaze, but at least they were different. this book i a near word for word tell of the first part of the movie. no idea why this exist except a yet another cash grab.",1,0.1,0,0.026
329,"if i had a car read like it was written by a child. however, if i was the art teach, i'd dock the creator a grade for rely entire upon cheesy clipart to illustrate hi book. if i had a car by t summerfield",1,0.4,1,0.361
330,"i read this a i had heard so many good the about it but i can't honest say i know what all the fuss i about! i found it a bit bore not necessarily because it a children book more because it just didn't seem to have a point at all! i found myself skipping section and look forward to getting it finish!",1,0.2,0.2,-0.704
331,"i can see how this would have been popular in it day but it i very date and thankful so. anyone who agree should go visit the 500's and check out just about any book on conservation or animal behavior.",1,0.4,1,0.9
332,"in certain way, here come the shaggedy i a throwback to the early goosebumps book. it written in third - person, a mode that became increasing rare a r. l. stine figure out the style of the series. the chapter are also usual long for a goosebumps book of the 2010s. welcome to dead house, monster blood, and other from the original series feature lengthy chapter, but they became short a r. l. stine found hi rhythm and audience. a few goosebumps classic have been set in and around mysterious swamp, and here come the shaggedy visit that environment with the story of kelli and h young broth shawn, city kid dragged to backwoods florida for a year so their father can study marine life in the swamp. they aren't please with the move in the first place, but they go from happy to terrify when they learn that something horrible i lurk in the brackish water. kelli promise h father she'll g florida a chance, but florida seem in no hurry to reciprocate. zeke and decker, twin from the one - room school that kelli and shawn are enroll in, ridicule the two new city kid, and tell disturb tale about a monster of the swamp. the shaggedy i ruthless, they say, attack people and destroy property indiscriminate. shawn, a natural fearful soul, beg hi father to go home to new york. kelli isn't convince there any swamp monster, but something bizarre i go on. monstrous footprint appear outside their house, and kelli catch a creepy old man who goes by the name rang saul sneak in the vicinity. whatever embellishment zeke and decker have add to the legend, the shaggedy i real, rang saul insist, a threat to everyone live near the swamp. can kelli cipher the truth before h family and neighbor are consume by a grotesque primordial beast... if the shaggedy exist at all? here come the shaggedy i slow pace than most goosebumps book, and doesn't entire make sense, but there are a few positive to it. the story feel different than much of what r. l. stine write, and shawn i an appeal character. it easy for u to feel protect of him, especial when he in real dang. my favorite goosebumps character i still billy deep, but i like shawn. i'll g here come the shaggedy one and a half star, and if you enjoy the first few installment in the most want sub - series, you'll probably be a fan of this book.",1,0.037,-0.278,0.814
333,"the mouse climb inside a treat or trick bag with candy and then the adventure begin.",1,0.4,0,0.586
334,"this book won the children book council of australia picture book of the year in 1980. frank that was before graeme base came along and blew out of the water this rather paltry effort at create intricate illustrate to match an alphabet or count book. the book start in "" the real world "" were a dragon goes to b with a cat and a rather large cutlass... then the "" way - out - there "" fantasy dream start... so i like the premise and set - up of the book. the dream sequence was more an actual dream sequence than a dream in a story. everything i joint, there doesn't seem to be any cause - and - affect and everything i bizarre - which doesn't make for a good narrate. the novelty of this book was to make it a puzzle book ( a perfect by graeme base ). within each count page there are an matching numb of a variety of different object. greame base doe this well because the object picture blend in the scene... pet pavey's method i to simply dump whatever happen to be in hi head at the time - why are there 10 lemon the size of garbage bin scatter around the street, 7 well within 20 mete, 6 card seashell in a courtroom??? noone know... but member it just a dream sequence so we can do whatever we want...",1,0.214,0.429,0.918
335,"view book for my job in a junior high library. a fair comprehensive collection of robot data deal with the evolution of robot from ear clumsy attempt to animate machine to today sophisticate vice bee use in industry and medicine. each double - page spread examine a different topic use numerous foldout and life - the - flaps. robot love will appreciate the interact format and the vivid illustrate. eyecatching cover sign.",2,0.45,0.4,0.881
336,"http: / / kachildrensbookreviews. blogspo... we receive this book via netgalley to g an hon view. so i figure a would like this book a she i three. she real a not very interest in it, a it didn't seem to hold h attention she was ask for another book to be read aft this one. this i a very simple book there wasn't much tail with the picture so i am sure that i why a didn't enjoy it. you have a young boy who i visit hi bear friend they real don't do much other than eat and watch tv. i think the picture could have use a bit more brighten up. there i real no dialogue between the two main character a the little boy just scribe what they are do and what not. for u this book was just not for u, but it may appeal to other. i say g this book a try and see for yourself if it i up your alley.",2,0.2,1,0.354
337,"i think i would've like this a lot better if it stuck more to what real happen. the mix of realistic face and cartoon mice, and of real space fact & anthropomorphized mousetronauts fuse me, and the author note, though interesting, didn't make it all better. i think kid will like this book though, and the illustrate, beside what i mention before, are great.",2,0.314,1,0.939
338,"i real want to g this one star! however, i did learn a few fact: how to pronounce fibonacci - - ( fib - uh - notch - ee ); the pic show the spiral in pinecones, pineapple, and sunflower were good; the info on the gold ratio or gold rectangle i more interesting to me. the numb i 1.61803 which i a portion in rectangle from the ancient greeks. perhaps my disatification with this title i there i no explanation a to why not all plant in nature form to this pattern, while 90 % may what i the reason for the exception and i there a ma explanation for that? this i my second title on this subject and i will ontinue to look for clarify.",2,0.16,0.556,0.438
339,"the theme, friendship, i attract, and the illustrate are naive but express, but i felt the story fell a little flat. young kid may relate to have a b friend who so close they are like two pea in a pod, and to the sad feel they would have if this friend move away. but the story doesn't leave you with anything special, it on acknowledge you would miss them and wasn't create about way to member them ( he goes on a plane to visit, then come home and that it ). there nothing wrong with it, but it not a picture book i can get excite about.",2,-0.075,0.455,0.958
340,"water color and p line show the dog in various position do hi various activities, but little expression. end paper sign seem to have little to do with the story. where did the dog get the collar and house if he ha no owner? very much like jane thayer's 1985 book "" the puppy who want a boy. "" this could be use for point of view.",2,0.2,1,0.662
341,"meh. although i like the mute winter tone of the illustrate the storyline i a little hard to follow due to too much imply mean for youngster.",2,0.1,-0.333,0.272
342,"i don't member a lot about this one, beyond the fact that i definite read it a a kid.",2,0,0,0.273
343,"the art style, layout and font are basically a straight homage to oliver jeffers, whose work i love! the story didn't quite live up to jeffers' b, though.",2,0.4,1,0.75
344,"ok, so i stumble across an article about the artist who did about seven bajillion * sweet valley high cover. now, when svh came out i was past their prime age demographic and never did read any of these. so i'm look over these cheesy cover and read the synopses of the book and $deity help me, i had to read one to see what all the hype was about. i mean, there what - 6,284 * * of these the? dear lord. these are... not good. you've got marysue1 and marysue2, perfectboyfriend, and stalkernewboy. throw in a dance and a twinconfusion kidnapping and hilarity ensue. it all work out in the end, but these two go through this every book? you'd think they'd get smart. i would feel bad give this book a one star because i am so very much not the demographic but i feel safe with a two star because i'm fair sure that miss perfect one & two would have annoy the crap out of me soon enough even a a teen. * slight exaggerate * * slight exaggerate",2,-0.043,0.111,0.819
345,"i love the illustrate but the story was all over the place.",2,0.6,1,0.382
346,"* meh * too long. too many shaky rhyme. too force. did i mention too long?!",2,-0.4,-1,-0.359
347,"i love the artwork - it ha a 60s / 70s feel which mind me of picture book from my own childhood. i wasn't taken with the text or the story, such a it was. a nice book from a graphic sign point of view, but it doesn't have that special something that bring you back to a picture book again and again.",2,0.533,1,0.321
348,"if you love ma, you'll love this book. if you hare ma ( like me ), it will just mind you how much you like it.",2,0.5,1,0.925
349,"cute book, but not sure what it was about. twelve year old martha boyle i obsess with ole, the girl she bare knew who die in a bicycle accident. she can't stop think about the similarity she share with ole, and h thought follow a she and h family go on vacation to cape cod. everything i different, h grandmother, h friend. i love the picture book by kevin henkes because he understand kids' emote and convey them so well. with this book i kept read to find out what would happen next, but i would not call it a rivet story, i would say it an introspect story. martha i explore the emote of never knowing ole when she was ale. she i also experiencing grow up a she start to like one of h summer friend. typical and normal story for kid, very well written, but not my favorite kind of book.",2,0.133,0.538,0.923
350,"i wish this had been a great book to read to my kid, because roberto clemente was such an awesome man. but... sometime the text i a list of stat, sometime it try to be a poem, sometime a non - fiction book. picture are pretty good.",2,0.48,1,0.934
351,"this i a sweet book about a young girl learn to step out of the box she was born to. winnie i the daughter of the wealthy family in town and h family i very overprotect. she live next to a wood which i own by h family but i never allow to leave the protection of the yard. when she final get up the courage to break the rule and goes out of the yard to chase what she think might be fairy music, she open h world to much much more. this book was written for the 8 - 10 crowd so definite there wasn't enough plot or character depth to keep me interest, but it was appropriate for the age group. what i didn't feel was appropriate for the age group was the interaction between jessie and winnie. jessie i a man who ha decade of experience, in the body of a 17 year old. winnie i a 10 year old girl who ha l a shelter life. yet jessie ask winnie to drink the water when she get a couple of year old so they can get marry and live happily ever aft forever. doe anyone else see the problem with this? he a fricking pedophile. pedophilia disguise a children fantasy i not fantastic.",2,0.218,0.571,0.959
352,"mallory ha apply to riverbend, a board school in rural massachusetts, aft becoming increasing alienate at stoneybrook middle school due to bully ( kristy in charge ). she i accept on a full scholarship for promise young writ, and she accept. jessi i angry, feel that mallory i abandon h, and that she i running away from h problem rather than face them. mallory insist that she i not running from something so much a she running to something great, and she ha to follow h dream. note that i have not mention mary anne yet. despite mary anne's narrator status, she doe basically nothing except watch this train wreck. mallory and jessi each complain about each other to mary anne. aft a few fail attempt to get them to work it out by co - assigning them bsc job and invite mallory to jessi's party, mary anne final bring them both over to h house and force them to have it out with each other, act a mediator. in the kid - oriented subplot, jessi encourage the pike siblings' feel that mallory i abandon them, and kristy and the other organize a holiday party for the resident of the nurse home stoneybrook manor. linger question: 1. the question that leap out on every page of this book i: why i this i a mary anne book? i see why this isn't mallory's book - - she go to narrate the next one, in which she start riverbend, and you can't have the same person narrate two book in a row - - but why not jessi? she hasn't had a book since # 115 ( jessi's big break ), and she won't get another before the end of the series. mary anne, meanwhile, will get the final book, the fire at mary anne's house, just six book from now. i understand that mary anne i a good listen, so if you're go to deal with this dispute from the perspective of an outside, she a logical choice, but this book say absolute nothing about mary anne or h arc. there a little of h feel awkward about h position in the middle, and she act to everything that happen, but overall h feel about the proceed are no more acute or usual than anyone else's. i like h bee the catalyst of the girls' make - up, but that could have happen in a mallory or a jessi book. i can't tell if the complete focus on mallory and jessi over mary anne i lazy ( the writ didn't bother give mary anne much to do ) or realistic ( a truly other - focus good listen would see the situate a bee all about x or y, and not herself ). maybe it would have been interesting if the author had run with mary anne's other - focus - ness and made it turn from a book about two other people to a book about mary anne's ability to deal with h own life when h friend are in a crisis, or h overbear attempt to make everyone get along even when h intervention make the problem worse? but it doesn't real go there. 2. why i jessi so sympathetic when she just went through the exact same the? i read this book right aft jessi's big break, so the about - face in jessi's feel about leave town to live your dream was particular jarring. jessi's month in new york i reference several time in this text, include a scene where jessi's nyc friend come to stoneybrook for a party and show sympathy for mallory's situate ( to jessi's dismay ). i'm glad the author member that this happen, but it seem weird that jessi i so dead - set against mallory leave to pursue h dream / career when not on was jessi tempt to do the same just a few book ago, but she didn't even seem to care that much that ( 1 ) mallory wasn't around and ( 2 ) mallory was back home, miss h. jessi insist that mallory's departure i "" different "", but she doesn't g reason why. i feel like there are a couple of miss step here. let try to draw them. jessi didn't miss mallory when she was away. conclusion: she assume mallory won't miss h. out of sight, out of mind, except when you're the one back home, bore, and constant mind of the the you use to do together. also: jessi ultimate chose not to go away to school. why not? that something else that wasn't explain to my satisfaction, i surmise in my view for # 115 that it was partly guilt. she want to go, but she felt guilty about how much h family / friend had miss h ( and how little she miss them ), and she decide she had responsibility at home and ought to put off h dream for awhile. mallory isn't make that choice. jessi resent mallory because she get what jessi want, and because h own guilt i not enough to stop h - - therefore, she seem to love jessi less than jessi love h. it would have been nice if any of this was in the book. 3. why are the eleven - year - olds always the one to get the career break? weird bsc rule: mallory lament h lack of a place at home - - school problem, getting lost in the shuffle of eight kid, an unimportant role even in the bsc. "" i won't be thirteen for two more year [ e. note: ha! ]. until then i'll be a junior office. "" but the original four start the bsc when they were 12, and they had their office right from book # 1. if thirteen i the official bsc start age for officership, it certain a hypocritical and ret - conny policy ( and i wouldn't be surprise if they change it every year to their current age ). in a similar weird oversight of the existence of twelve - year - olds, kristy decide not to hire a place for mallory because the eighth grade at sms i tapped out and they can't think of any six - grad a mature a mallory and jessi. leave aside the two other middle school in stoneybrook, why doesn't claudia nominate some of h seven - grade friend? adult watch: mrs. pike ha a full - time temp job a a salesperson at bellair's for the holiday rush. h friend maureen mcgill must have gotten h the job. time: december. mallory i go to start h new school in the spring semester. the book end before the holiday, but goes far enough to december to include a pre - christmas holiday party. riverbend sure doesn't mind about last - minute decisions, huh? vise timeline: riverbend i just 100 % college ( the next book will move all doubt ). in an ideal world, this plot develop would have happen when my vise timeline indicate that mallory was a rise college freshman, but we miss that signpost a long time ago. she still in college by my vise timeline, but she in h senior year, so it seem weird to be transferring for just one semester. maybe she i actual graduate ear and go directly to a geographical distant postgrad gram. jessi doesn't have a leg to stand on expect them to stay together much longer, though, especial since she almost certain move to nyc aft graduate, and mallory state in # 115 that she could never live there.",2,-0.063,-0.013,0.995
353,"lm y`jbny bd. l hw~ hd lnw` mn lktb",2,0,0,0.459
354,"will monster get a christmas tree in time for christmas?",2,0,-1,0
355,"i real didn't like this book. i thought it would be good but i am very protect about star war and star trek and all the steal from those movie and from space ball, it real turn me off for this book. it was too busy and you real didn't get to know any of the character. i did like the illustrate but, like i said, it was too busy.",2,0.171,0.111,0.022
356,"* * spoil alert * * i member read a book contain a series of story about the dreamtime and the rainbow serpent a a child, then when i was a little old read my place by sally morgan. i was mind of this on a recent trip to central australia, but despite these ear introductions i was shock at the level of my ignorance of the culture of indigenous australians. to assist in break down this ignorance, both for me and x - man ( a he grow up ), i decide to aboriginal and torres strait island children story would be part of hi life from a young age. this i relative easy these day with the availability of large numb of indigenous story, by indigenous author and illustrator. also check out australian museum indigenous australia site which contain 20 create story from around australia - avail a text, audio, or video. so this i the first one! given there i no description what i i about? this i a story from the wongutha people from the eastern goldfield of western australia ( around kalgoorlie ) about how a constellation of star ( the seven sister ) came to have it current figuration. the seven sister come down to earth in human form, and get stalk by some male yayarrs ( small men who could also travel to the star ) look for wive. eventual one yayarr male single out one of the sister a she drink from a creek. he chase h, briefly capture h, attempt to beat h with a stick, and eventual she escape. she turn to the hill where they had land on earth on to cover h 6 other sister had already turn to the sky. this i why the seven sister constellation consist of a group of 6 star, and one star trail behind. first a warn - this book was design for a much old audience than x - man, so i can't real judge it for it primary audience. the story itself seem a little violent for our modern ( maybe over - protect ) sensibilities. a pack of men stalk some young women try to make them 'their wives'. wait for one sister to leave the group, then chase h ( "" ran like she'd never run before ""... "" h heart thump loud and she gasp for breath. she knew she had to escape. "" ) then rough grabbing h and attempt to beat h with a "" big stick "". final she escape. the story real doesn't end happily. the story end with the sister realising h sister had left h on earth and h response: "" tremble and shake all over the woman cry... ( i'm alone. what will i do? ). the woman cry and cry for a long time "". i suppose it was told a a cautionary tale about why it i critical to stay with the group... 'stay with your dad a we go through the shoppe centre or you will end up like the seven sister... '. but in all i thought it was a little violent and sad ( maybe i'll be happy with this a x - man get old? )",2,-0.15,-0.257,-0.985
357,"the snow queen how i feel aft read this. i have no idea what the moral of this fairy tale i.",2,-0.2,1,-0.296
358,"( audio ) eh. ok. i guess.",2,0,1,0.34
